{
  "$schema": "https://json-schema.org/draft/2020-12/schema",
  "$id": "https://github.com/clivingston33/benching/benchmark/schemas/summary-v1.schema.json",
  "title": "Benching canonical run summary (schema v1)",
  "description": "Portable per-run result produced by analytics/analyze.py from raw proxy telemetry plus Harbor task results. Units: milliseconds for latency fields, tokens per second for TPS fields, fractions in [0, 1] for rates. Null means unavailable/unknown, never zero. Unknown extra fields are allowed (additive evolution) and stripped by consumer projection, never rendered blindly.",
  "type": "object",
  "required": [
    "schema_version",
    "run_id",
    "created_at_utc",
    "benchmark",
    "provider",
    "model",
    "reasoning",
    "execution",
    "score",
    "speed",
    "latency",
    "reliability",
    "tokens",
    "context",
    "tasks"
  ],
  "properties": {
    "schema_version": {
      "description": "Major contract version. Only 1 is supported; future majors are classified unsupported, never parsed as v1.",
      "const": 1
    },
    "run_id": {"type": "string", "minLength": 1},
    "created_at_utc": {
      "type": "string",
      "pattern": "^\\d{4}-\\d{2}-\\d{2}T\\d{2}:\\d{2}:\\d{2}"
    },
    "metric_revision": {
      "description": "Analyzer metric-definition revision (2 = explicit stream completion, semantic output counting, independent per-run normalization, planned task accounting). Optional so pre-revision artifacts stay valid.",
      "type": "integer",
      "minimum": 1
    },
    "tokenizer": {
      "description": "Pinned tokenizer identity and whether local counting was actually available for this run. Optional so older artifacts stay valid.",
      "type": "object",
      "required": ["repo", "revision", "available"],
      "additionalProperties": false,
      "properties": {
        "repo": {"type": ["string", "null"]},
        "revision": {"type": ["string", "null"]},
        "available": {"type": ["boolean", "null"]}
      }
    },
    "benchmark": {
      "type": "object",
      "required": ["name", "version", "task_count"],
      "properties": {
        "name": {"type": "string"},
        "version": {"type": "string"},
        "task_count": {"type": "integer", "minimum": 0}
      }
    },
    "provider": {
      "type": "object",
      "required": ["id", "name"],
      "properties": {
        "id": {"type": "string"},
        "name": {"type": "string"}
      }
    },
    "model": {"type": "string"},
    "reasoning": {"type": "string", "enum": ["default", "enabled", "disabled"]},
    "execution": {
      "type": "object",
      "required": ["concurrency", "trials"],
      "properties": {
        "concurrency": {"type": "integer", "minimum": 0},
        "trials": {"type": "integer", "minimum": 0}
      }
    },
    "score": {
      "type": "object",
      "required": ["value", "passed", "failed", "total", "success_rate", "errored", "timeout"],
      "properties": {
        "value": {"type": ["number", "null"]},
        "passed": {"type": "integer", "minimum": 0},
        "failed": {"type": "integer", "minimum": 0},
        "total": {"type": "integer", "minimum": 0},
        "success_rate": {"type": ["number", "null"]},
        "errored": {"type": "integer", "minimum": 0},
        "timeout": {"type": "integer", "minimum": 0}
      }
    },
    "speed": {
      "type": "object",
      "required": ["decode_tps", "effective_tps", "output_tps_mean", "output_tps_p50", "output_tps_p95"],
      "properties": {
        "decode_tps": {"$ref": "#/$defs/distribution"},
        "effective_tps": {"$ref": "#/$defs/distribution"},
        "output_tps_mean": {"type": ["number", "null"]},
        "output_tps_p50": {"type": ["number", "null"]},
        "output_tps_p95": {"type": ["number", "null"]}
      }
    },
    "latency": {
      "type": "object",
      "required": ["ttft_ms", "decode_duration_ms", "end_to_end_latency_ms", "ttft_ms_mean", "ttft_ms_p50", "ttft_ms_p95"],
      "properties": {
        "ttft_ms": {"$ref": "#/$defs/distribution"},
        "decode_duration_ms": {"$ref": "#/$defs/distribution"},
        "end_to_end_latency_ms": {"$ref": "#/$defs/distribution"},
        "ttft_ms_mean": {"type": ["number", "null"]},
        "ttft_ms_p50": {"type": ["number", "null"]},
        "ttft_ms_p95": {"type": ["number", "null"]}
      }
    },
    "reliability": {
      "type": "object",
      "required": ["successful_requests", "failed_requests", "success_rate"],
      "properties": {
        "successful_requests": {"type": "integer", "minimum": 0},
        "failed_requests": {"type": "integer", "minimum": 0},
        "success_rate": {"type": ["number", "null"], "minimum": 0, "maximum": 1},
        "request_success_rate": {"type": ["number", "null"], "minimum": 0, "maximum": 1},
        "stream_completion_rate": {"type": ["number", "null"], "minimum": 0, "maximum": 1},
        "http_error_rate": {"type": ["number", "null"], "minimum": 0, "maximum": 1},
        "timeout_rate": {"type": ["number", "null"], "minimum": 0, "maximum": 1},
        "provider_failures": {"type": "integer", "minimum": 0},
        "downstream_cancellations": {"type": "integer", "minimum": 0},
        "incomplete_provider_streams": {"type": "integer", "minimum": 0},
        "errors": {"type": "integer", "minimum": 0}
      }
    },
    "tokens": {
      "description": "Provider-reported totals plus locally counted output. Null means unavailable, never estimated.",
      "type": "object",
      "required": ["input", "output", "input_provider", "output_provider", "total_provider", "cache_read", "cache_write", "output_local"],
      "properties": {
        "input": {"type": ["number", "null"]},
        "output": {"type": ["number", "null"]},
        "input_provider": {"type": ["number", "null"]},
        "output_provider": {"type": ["number", "null"]},
        "total_provider": {"type": ["number", "null"]},
        "cache_read": {"type": ["number", "null"]},
        "cache_write": {"type": ["number", "null"]},
        "output_local": {"type": ["number", "null"]}
      }
    },
    "context": {
      "description": "Request counts by provider input-token half-open buckets ([0,4K), [4K,16K), ...) plus an explicit unknown bucket. Bucketed plus unknown always equals the analyzed request population; unknown input is never assigned to a zero-token bucket.",
      "type": "object",
      "required": ["0-4K", "4K-16K", "16K-32K", "32K-64K", "64K+"],
      "additionalProperties": {"$ref": "#/$defs/context_bucket"},
      "properties": {
        "0-4K": {"$ref": "#/$defs/context_bucket"},
        "4K-16K": {"$ref": "#/$defs/context_bucket"},
        "16K-32K": {"$ref": "#/$defs/context_bucket"},
        "32K-64K": {"$ref": "#/$defs/context_bucket"},
        "64K+": {"$ref": "#/$defs/context_bucket"},
        "unknown": {"$ref": "#/$defs/context_bucket"}
      }
    },
    "tasks": {
      "type": "array",
      "items": {"$ref": "#/$defs/task_result"}
    }
  },
  "$defs": {
    "distribution": {
      "description": "Aggregate distribution; null statistics mean no samples, never zero. Older producers emitted only the required core keys.",
      "type": "object",
      "required": ["count", "mean", "median", "p50", "p95"],
      "properties": {
        "count": {"type": "integer", "minimum": 0},
        "mean": {"type": ["number", "null"]},
        "median": {"type": ["number", "null"]},
        "min": {"type": ["number", "null"]},
        "max": {"type": ["number", "null"]},
        "p5": {"type": ["number", "null"]},
        "p25": {"type": ["number", "null"]},
        "p75": {"type": ["number", "null"]},
        "p90": {"type": ["number", "null"]},
        "p95": {"type": ["number", "null"]},
        "p99": {"type": ["number", "null"]},
        "stdev": {"type": ["number", "null"]},
        "cv": {"type": ["number", "null"]},
        "p50": {"type": ["number", "null"]}
      }
    },
    "context_bucket": {
      "type": "object",
      "required": ["requests", "ttft_ms", "decode_tps", "end_to_end_latency_ms", "failure_rate"],
      "properties": {
        "requests": {"type": "integer", "minimum": 0},
        "ttft_ms": {"$ref": "#/$defs/context_metric"},
        "decode_tps": {"$ref": "#/$defs/context_metric"},
        "end_to_end_latency_ms": {
          "type": "object",
          "required": ["mean"],
          "properties": {
            "mean": {"type": ["number", "null"]},
            "p50": {"type": ["number", "null"]},
            "p95": {"type": ["number", "null"]}
          }
        },
        "failure_rate": {"type": ["number", "null"], "minimum": 0, "maximum": 1}
      }
    },
    "context_metric": {
      "type": "object",
      "required": ["mean", "p50", "p95"],
      "properties": {
        "mean": {"type": ["number", "null"]},
        "p50": {"type": ["number", "null"]},
        "p95": {"type": ["number", "null"]}
      }
    },
    "task_result": {
      "description": "One (task, trial) accounting entry. Planned-but-unobserved work appears with requests 0 and null verdict fields: explicit absence, never a fabricated failure.",
      "type": "object",
      "required": ["task_id", "trial_id", "passed", "reward", "duration_sec", "exception", "timeout", "requests", "tokens", "latency", "reliability"],
      "properties": {
        "task_id": {"type": "string"},
        "trial_id": {"type": ["string", "null"]},
        "passed": {"type": ["boolean", "null"]},
        "reward": {"type": ["number", "null"]},
        "duration_sec": {"type": ["number", "null"]},
        "exception": {"type": ["string", "null"]},
        "timeout": {"type": ["boolean", "null"]},
        "requests": {"type": "integer", "minimum": 0},
        "tokens": {
          "type": "object",
          "required": ["input", "output", "cache_read", "cache_write"],
          "properties": {
            "input": {"type": ["number", "null"]},
            "output": {"type": ["number", "null"]},
            "cache_read": {"type": ["number", "null"]},
            "cache_write": {"type": ["number", "null"]}
          }
        },
        "latency": {
          "type": "object",
          "required": ["ttft_ms_mean", "ttft_ms_p50", "ttft_ms_p95", "end_to_end_latency_ms_mean"],
          "properties": {
            "ttft_ms_mean": {"type": ["number", "null"]},
            "ttft_ms_p50": {"type": ["number", "null"]},
            "ttft_ms_p95": {"type": ["number", "null"]},
            "end_to_end_latency_ms_mean": {"type": ["number", "null"]}
          }
        },
        "reliability": {
          "type": "object",
          "required": ["successful_requests", "failed_requests", "success_rate"],
          "properties": {
            "successful_requests": {"type": "integer", "minimum": 0},
            "failed_requests": {"type": "integer", "minimum": 0},
            "success_rate": {"type": ["number", "null"], "minimum": 0, "maximum": 1}
          }
        }
      }
    }
  }
}
