{
  "schema_version": 1,
  "metric_revision": 2,
  "run_id": "bench-example-fireworks-b",
  "created_at_utc": "2026-09-08T00:00:00Z",
  "tokenizer": {
    "repo": "org/example-tok",
    "revision": "rev-1",
    "available": true
  },
  "benchmark": {
    "name": "terminal-bench",
    "version": "2.1",
    "task_count": 2
  },
  "provider": {
    "id": "fireworks",
    "name": "Fireworks"
  },
  "model": "glm-5.2",
  "reasoning": "default",
  "execution": {
    "concurrency": 1,
    "trials": 1
  },
  "score": {
    "value": 1.0,
    "passed": 2,
    "failed": 0,
    "total": 2,
    "success_rate": 1.0,
    "errored": 0,
    "timeout": 0
  },
  "speed": {
    "decode_tps": {
      "count": 2,
      "mean": 90.0,
      "median": 90.0,
      "min": 90.0,
      "max": 90.0,
      "p5": 90.0,
      "p25": 90.0,
      "p75": 90.0,
      "p90": 90.0,
      "p95": 90.0,
      "p99": 90.0,
      "stdev": 0.0,
      "cv": 0.0,
      "p50": 90.0
    },
    "effective_tps": {
      "count": 2,
      "mean": 45.0,
      "median": 45.0,
      "min": 45.0,
      "max": 45.0,
      "p5": 45.0,
      "p25": 45.0,
      "p75": 45.0,
      "p90": 45.0,
      "p95": 45.0,
      "p99": 45.0,
      "stdev": 0.0,
      "cv": 0.0,
      "p50": 45.0
    },
    "output_tps_mean": 90.0,
    "output_tps_p50": 90.0,
    "output_tps_p95": 90.0
  },
  "latency": {
    "ttft_ms": {
      "count": 2,
      "mean": 0.0,
      "median": 0.0,
      "min": 0.0,
      "max": 0.0,
      "p5": 0.0,
      "p25": 0.0,
      "p75": 0.0,
      "p90": 0.0,
      "p95": 0.0,
      "p99": 0.0,
      "stdev": 0.0,
      "cv": null,
      "p50": 0.0
    },
    "decode_duration_ms": {
      "count": 2,
      "mean": 1000.0,
      "median": 1000.0,
      "min": 1000.0,
      "max": 1000.0,
      "p5": 1000.0,
      "p25": 1000.0,
      "p75": 1000.0,
      "p90": 1000.0,
      "p95": 1000.0,
      "p99": 1000.0,
      "stdev": 0.0,
      "cv": 0.0,
      "p50": 1000.0
    },
    "end_to_end_latency_ms": {
      "count": 2,
      "mean": 2000.0,
      "median": 2000.0,
      "min": 2000.0,
      "max": 2000.0,
      "p5": 2000.0,
      "p25": 2000.0,
      "p75": 2000.0,
      "p90": 2000.0,
      "p95": 2000.0,
      "p99": 2000.0,
      "stdev": 0.0,
      "cv": 0.0,
      "p50": 2000.0
    },
    "ttft_ms_mean": 0.0,
    "ttft_ms_p50": 0.0,
    "ttft_ms_p95": 0.0
  },
  "reliability": {
    "request_success_rate": 1.0,
    "stream_completion_rate": 1.0,
    "http_error_rate": 0.0,
    "timeout_rate": 0.0,
    "provider_failures": 0,
    "downstream_cancellations": 0,
    "incomplete_provider_streams": 0,
    "errors": 0,
    "successful_requests": 2,
    "failed_requests": 0,
    "success_rate": 1.0
  },
  "tokens": {
    "input_provider": 100.0,
    "output_provider": 180.0,
    "total_provider": 280.0,
    "cache_read": null,
    "cache_write": null,
    "output_local": 180.0,
    "input": 100.0,
    "output": 180.0
  },
  "context": {
    "0-4K": {
      "requests": 2,
      "ttft_ms": {
        "mean": 0.0,
        "p50": 0.0,
        "p95": 0.0
      },
      "decode_tps": {
        "mean": 90.0,
        "p50": 90.0,
        "p95": 90.0
      },
      "end_to_end_latency_ms": {
        "mean": 2000.0
      },
      "failure_rate": 0.0
    },
    "4K-16K": {
      "requests": 0,
      "ttft_ms": {
        "mean": null,
        "p50": null,
        "p95": null
      },
      "decode_tps": {
        "mean": null,
        "p50": null,
        "p95": null
      },
      "end_to_end_latency_ms": {
        "mean": null
      },
      "failure_rate": null
    },
    "16K-32K": {
      "requests": 0,
      "ttft_ms": {
        "mean": null,
        "p50": null,
        "p95": null
      },
      "decode_tps": {
        "mean": null,
        "p50": null,
        "p95": null
      },
      "end_to_end_latency_ms": {
        "mean": null
      },
      "failure_rate": null
    },
    "32K-64K": {
      "requests": 0,
      "ttft_ms": {
        "mean": null,
        "p50": null,
        "p95": null
      },
      "decode_tps": {
        "mean": null,
        "p50": null,
        "p95": null
      },
      "end_to_end_latency_ms": {
        "mean": null
      },
      "failure_rate": null
    },
    "64K+": {
      "requests": 0,
      "ttft_ms": {
        "mean": null,
        "p50": null,
        "p95": null
      },
      "decode_tps": {
        "mean": null,
        "p50": null,
        "p95": null
      },
      "end_to_end_latency_ms": {
        "mean": null
      },
      "failure_rate": null
    },
    "unknown": {
      "requests": 0,
      "ttft_ms": {
        "mean": null,
        "p50": null,
        "p95": null
      },
      "decode_tps": {
        "mean": null,
        "p50": null,
        "p95": null
      },
      "end_to_end_latency_ms": {
        "mean": null
      },
      "failure_rate": null
    }
  },
  "tasks": [
    {
      "task_id": "task-a",
      "trial_id": "trial-0",
      "passed": true,
      "reward": 1.0,
      "duration_sec": null,
      "exception": null,
      "timeout": false,
      "requests": 1,
      "tokens": {
        "input": 50.0,
        "output": 90.0,
        "cache_read": null,
        "cache_write": null
      },
      "latency": {
        "ttft_ms_mean": 0.0,
        "ttft_ms_p50": 0.0,
        "ttft_ms_p95": 0.0,
        "end_to_end_latency_ms_mean": 2000.0
      },
      "reliability": {
        "successful_requests": 1,
        "failed_requests": 0,
        "success_rate": 1.0
      }
    },
    {
      "task_id": "task-b",
      "trial_id": "trial-0",
      "passed": true,
      "reward": 1.0,
      "duration_sec": null,
      "exception": null,
      "timeout": false,
      "requests": 1,
      "tokens": {
        "input": 50.0,
        "output": 90.0,
        "cache_read": null,
        "cache_write": null
      },
      "latency": {
        "ttft_ms_mean": 0.0,
        "ttft_ms_p50": 0.0,
        "ttft_ms_p95": 0.0,
        "end_to_end_latency_ms_mean": 2000.0
      },
      "reliability": {
        "successful_requests": 1,
        "failed_requests": 0,
        "success_rate": 1.0
      }
    }
  ]
}
